{
  "schema_version": "1.0.0",
  "provider": "synthetic-provider",
  "provider_version": "fixture-1",
  "sample_id": "sample-out-of-range-0001",
  "capture_time_ms": 1400,
  "occurred_at": "2026-01-01T10:00:01Z",
  "x_px": 1025,
  "y_px": 100,
  "valid": true,
  "quality": {"confidence": 0.5, "flags": []}
}
